<?xml version="1.0" encoding="UTF-8"?>
<!DOCTYPE application SYSTEM "../../Resource/DTD/application.dtd">
<application>
    <meta>
        <name>configuration</name>
        <description>edit_configuration</description>
        <icon>app-preferences-enviornment</icon>
        <version>0.10.20061011</version>
        <guid>org.bambuscms.configuration</guid>
        <categories>
            <category name="system" />
        </categories>
    </meta>
    <window title="edit" icon="action-edit">
        <controller src="controller.php" />
        <view src="edit.php" type="php" />
    </window>
</application>